{
  "schema_version": "agent-dossier.v1",
  "dossier_id": "osm:way/641097567:codex:gpt-5.6-sol:researcher.v1:pilot-2026-09-10",
  "place": {
    "place_ref": "osm:way/641097567",
    "name": "St Bartholomew's Anglican Church - Kaiapoi",
    "country_code": "NZ",
    "seed_latitude": -43.38149042222222,
    "seed_longitude": 172.66124577777776,
    "seed_source": "nz_places.geojson (overpass extract 2025-08-20)",
    "seed_tags": {
      "amenity": "place_of_worship",
      "religion": "christian",
      "denomination": "anglican"
    }
  },
  "candidate_location": {
    "latitude": -43.381498,
    "longitude": 172.661256,
    "basis": "osm_object",
    "basis_note": "Approximate centre of the building footprint represented by OSM way 641097567, calculated from its eight distinct boundary nodes.",
    "uncertainty_radius_m": 5,
    "address": "23 Cass Street, Kaiapoi 7630, New Zealand"
  },
  "claims": [
    {
      "claim_id": "osm:way/641097567:codex:c01",
      "claim_type": "name",
      "value": "St Bartholomew’s – Kaiapoi",
      "date_start": null,
      "date_end": null,
      "date_precision": "unknown",
      "source": {
        "locator": "https://www.anglicanlife.org.nz/church/st-bartholomews-kaiapoi-kaiapoi-parish/",
        "source_name": "Anglican Life church directory",
        "source_type": "diocesan_publication",
        "source_date": null,
        "source_date_basis": "not_stated",
        "retrieved_at": "2026-09-10"
      },
      "quoted_support": "St Bartholomew’s – Kaiapoi – Kaiapoi Parish",
      "evidential_weight": "primary_institutional",
      "reader": {
        "reader_id": "codex:gpt-5.6-sol:researcher.v1",
        "backend": "codex",
        "model_id": "gpt-5.6-sol",
        "prompt_version": "researcher.v1"
      },
      "confidence": "high",
      "note": "Current diocesan directory form of the name."
    },
    {
      "claim_id": "osm:way/641097567:codex:c02",
      "claim_type": "address",
      "value": "23 Cass Street, Kaiapoi 7630, New Zealand",
      "date_start": null,
      "date_end": null,
      "date_precision": "unknown",
      "source": {
        "locator": "https://www.anglicanlife.org.nz/church/st-bartholomews-kaiapoi-kaiapoi-parish/",
        "source_name": "Anglican Life church directory",
        "source_type": "diocesan_publication",
        "source_date": null,
        "source_date_basis": "not_stated",
        "retrieved_at": "2026-09-10"
      },
      "quoted_support": "23 Cass Street, Kaiapoi, New Zealand",
      "evidential_weight": "primary_institutional",
      "reader": {
        "reader_id": "codex:gpt-5.6-sol:researcher.v1",
        "backend": "codex",
        "model_id": "gpt-5.6-sol",
        "prompt_version": "researcher.v1"
      },
      "confidence": "high",
      "note": "The postcode 7630 appears in the directory immediately above this address."
    },
    {
      "claim_id": "osm:way/641097567:codex:c03",
      "claim_type": "religion",
      "value": "Christian",
      "date_start": null,
      "date_end": null,
      "date_precision": "unknown",
      "source": {
        "locator": "https://api.openstreetmap.org/api/0.6/way/641097567/history",
        "source_name": "OpenStreetMap way history API",
        "source_type": "osm",
        "source_date": "2026-01-31",
        "source_date_basis": "metadata",
        "retrieved_at": "2026-09-10"
      },
      "quoted_support": "<tag k=\"religion\" v=\"christian\"/>",
      "evidential_weight": "user_contributed",
      "reader": {
        "reader_id": "codex:gpt-5.6-sol:researcher.v1",
        "backend": "codex",
        "model_id": "gpt-5.6-sol",
        "prompt_version": "researcher.v1"
      },
      "confidence": "high",
      "note": "Consistent with the diocesan and heritage sources."
    },
    {
      "claim_id": "osm:way/641097567:codex:c04",
      "claim_type": "denomination",
      "value": "Anglican",
      "date_start": null,
      "date_end": null,
      "date_precision": "unknown",
      "source": {
        "locator": "https://www.heritage.org.nz/list-details/285/Listing",
        "source_name": "Heritage New Zealand List entry 285",
        "source_type": "heritage_register",
        "source_date": "2002-03-28",
        "source_date_basis": "printed",
        "retrieved_at": "2026-09-10"
      },
      "quoted_support": "The Anglican Church of St Bartholomew's in Kaiapoi is the oldest surviving church in Canterbury.",
      "evidential_weight": "primary_institutional",
      "reader": {
        "reader_id": "codex:gpt-5.6-sol:researcher.v1",
        "backend": "codex",
        "model_id": "gpt-5.6-sol",
        "prompt_version": "researcher.v1"
      },
      "confidence": "high",
      "note": "The current diocesan directory independently lists the church."
    },
    {
      "claim_id": "osm:way/641097567:codex:c05",
      "claim_type": "start_date",
      "value": "Anglican worship at the present Cass Street site began in 1860 when the relocated church reopened.",
      "date_start": "1860",
      "date_end": "1860",
      "date_precision": "year",
      "source": {
        "locator": "https://www.heritage.org.nz/list-details/285/Listing",
        "source_name": "Heritage New Zealand List entry 285",
        "source_type": "heritage_register",
        "source_date": "2002-03-28",
        "source_date_basis": "printed",
        "retrieved_at": "2026-09-10"
      },
      "quoted_support": "To present site. Reopened 1860 with the addition of a bell tower",
      "evidential_weight": "primary_institutional",
      "reader": {
        "reader_id": "codex:gpt-5.6-sol:researcher.v1",
        "backend": "codex",
        "model_id": "gpt-5.6-sol",
        "prompt_version": "researcher.v1"
      },
      "confidence": "high",
      "note": "The building had previously stood at Darnley Square; 1860 is therefore the site-specific worship start, not the building's construction date."
    },
    {
      "claim_id": "osm:way/641097567:codex:c06",
      "claim_type": "building_date",
      "value": "The present church building was constructed in 1855 and completed by Christmas Day.",
      "date_start": "1855",
      "date_end": "1855",
      "date_precision": "year",
      "source": {
        "locator": "https://www.heritage.org.nz/list-details/285/Listing",
        "source_name": "Heritage New Zealand List entry 285",
        "source_type": "heritage_register",
        "source_date": "2002-03-28",
        "source_date_basis": "printed",
        "retrieved_at": "2026-09-10"
      },
      "quoted_support": "Start Year 1855 Type Original Construction Description Completed by Christmas Day",
      "evidential_weight": "primary_institutional",
      "reader": {
        "reader_id": "codex:gpt-5.6-sol:researcher.v1",
        "backend": "codex",
        "model_id": "gpt-5.6-sol",
        "prompt_version": "researcher.v1"
      },
      "confidence": "high",
      "note": "This is the date of the surviving building, which was subsequently relocated."
    },
    {
      "claim_id": "osm:way/641097567:codex:c07",
      "claim_type": "worship_active_asof",
      "value": "The first service in the original building was held on Christmas Day 1855.",
      "date_start": "1855-12-25",
      "date_end": "1855-12-25",
      "date_precision": "day",
      "source": {
        "locator": "https://www.heritage.org.nz/list-details/285/Listing",
        "source_name": "Heritage New Zealand List entry 285",
        "source_type": "heritage_register",
        "source_date": "2002-03-28",
        "source_date_basis": "printed",
        "retrieved_at": "2026-09-10"
      },
      "quoted_support": "the first service was held in the church on Christmas Day, 1855.",
      "evidential_weight": "primary_institutional",
      "reader": {
        "reader_id": "codex:gpt-5.6-sol:researcher.v1",
        "backend": "codex",
        "model_id": "gpt-5.6-sol",
        "prompt_version": "researcher.v1"
      },
      "confidence": "high",
      "note": "This service occurred at the building's original Darnley Square site."
    },
    {
      "claim_id": "osm:way/641097567:codex:c08",
      "claim_type": "renovation",
      "value": "The church was relocated to Cass Street between 1859 and 1860 and reopened with a bell tower.",
      "date_start": "1859",
      "date_end": "1860",
      "date_precision": "year",
      "source": {
        "locator": "https://www.heritage.org.nz/list-details/285/Listing",
        "source_name": "Heritage New Zealand List entry 285",
        "source_type": "heritage_register",
        "source_date": "2002-03-28",
        "source_date_basis": "printed",
        "retrieved_at": "2026-09-10"
      },
      "quoted_support": "The move was completed by the end of May 1860. Two years later transepts, a bell tower and a chancel were added.",
      "evidential_weight": "primary_institutional",
      "reader": {
        "reader_id": "codex:gpt-5.6-sol:researcher.v1",
        "backend": "codex",
        "model_id": "gpt-5.6-sol",
        "prompt_version": "researcher.v1"
      },
      "confidence": "high",
      "note": "The register's construction table separately describes the reopening as including a bell tower."
    },
    {
      "claim_id": "osm:way/641097567:codex:c09",
      "claim_type": "renovation",
      "value": "Transepts and a chancel were added in 1862.",
      "date_start": "1862",
      "date_end": "1862",
      "date_precision": "year",
      "source": {
        "locator": "https://www.heritage.org.nz/list-details/285/Listing",
        "source_name": "Heritage New Zealand List entry 285",
        "source_type": "heritage_register",
        "source_date": "2002-03-28",
        "source_date_basis": "printed",
        "retrieved_at": "2026-09-10"
      },
      "quoted_support": "Start Year 1862 Type Addition Description Addition of transepts and chancel",
      "evidential_weight": "primary_institutional",
      "reader": {